{
  "$comment": "GENERATED by `npm run canon:world` from canon biomes, locations, geography and art/atlas manifests. Do not edit. Anchors are canon's normalized 1000×1000 label anchors (geography.yaml, world_metadata); the image is the realm painting, served from /assets.",
  "title": "The Realm of Red Sky",
  "image": {
    "src": "/assets/world/realm-atlas-detail-v1.webp",
    "width": 1024,
    "height": 909
  },
  "places": {
    "academy": {
      "id": "location.academy",
      "title": "The Academy",
      "kind": "location",
      "anchor": {
        "x": 225,
        "y": 608
      },
      "parent": "whispering_marsh"
    },
    "bone_yard": {
      "id": "location.bone_yard",
      "title": "The Bone Yard",
      "kind": "location",
      "anchor": {
        "x": 875,
        "y": 805
      },
      "parent": "sallow_wastelands"
    },
    "conservatory": {
      "id": "location.conservatory",
      "title": "The Conservatory",
      "kind": "location",
      "anchor": {
        "x": 805,
        "y": 73
      },
      "parent": "glacier_of_origins"
    },
    "dojo": {
      "id": "location.dojo",
      "title": "The Dojo",
      "kind": "location",
      "anchor": {
        "x": 165,
        "y": 223
      },
      "parent": "sky_islands"
    },
    "eastern_plains": {
      "id": "biome.eastern_plains",
      "title": "The Eastern Plains",
      "kind": "biome",
      "anchor": {
        "x": 750,
        "y": 445
      },
      "parent": null
    },
    "enchanted_woods": {
      "id": "biome.enchanted_woods",
      "title": "Enchanted Woods",
      "kind": "biome",
      "anchor": {
        "x": 220,
        "y": 395
      },
      "parent": null
    },
    "exchange": {
      "id": "location.exchange",
      "title": "The Exchange",
      "kind": "location",
      "anchor": {
        "x": 350,
        "y": 855
      },
      "parent": "sunward_fields"
    },
    "expanse": {
      "id": "biome.expanse",
      "title": "The Expanse",
      "kind": "biome",
      "anchor": {
        "x": 470,
        "y": 75
      },
      "parent": null
    },
    "frostfang_peaks": {
      "id": "biome.frostfang_peaks",
      "title": "Frostfang Peaks",
      "kind": "biome",
      "anchor": {
        "x": 825,
        "y": 275
      },
      "parent": null
    },
    "glacier_of_origins": {
      "id": "biome.glacier_of_origins",
      "title": "Glacier of Origins",
      "kind": "biome",
      "anchor": {
        "x": 805,
        "y": 85
      },
      "parent": null
    },
    "mermaid_cove": {
      "id": "biome.mermaid_cove",
      "title": "Mermaid Cove",
      "kind": "biome",
      "anchor": {
        "x": 690,
        "y": 925
      },
      "parent": null
    },
    "mosshome": {
      "id": "location.mosshome",
      "title": "MossHome",
      "kind": "location",
      "anchor": {
        "x": 115,
        "y": 525
      },
      "parent": "enchanted_woods"
    },
    "mount_red_sky": {
      "id": "location.mount_red_sky",
      "title": "Mount Red Sky",
      "kind": "location",
      "anchor": {
        "x": 465,
        "y": 325
      },
      "parent": "red_sky_foothills"
    },
    "plains": {
      "id": "biome.plains",
      "title": "The Plains",
      "kind": "biome",
      "anchor": {
        "x": 455,
        "y": 520
      },
      "parent": null
    },
    "red_sky_foothills": {
      "id": "biome.red_sky_foothills",
      "title": "Red Sky Foothills",
      "kind": "biome",
      "anchor": {
        "x": 440,
        "y": 410
      },
      "parent": null
    },
    "rookery": {
      "id": "location.rookery",
      "title": "The Rookery",
      "kind": "location",
      "anchor": {
        "x": 350,
        "y": 843
      },
      "parent": "sunward_fields"
    },
    "sallow_wastelands": {
      "id": "biome.sallow_wastelands",
      "title": "The Sallow Wastelands",
      "kind": "biome",
      "anchor": {
        "x": 800,
        "y": 840
      },
      "parent": null
    },
    "skullwater_cave": {
      "id": "location.skullwater_cave",
      "title": "Skullwater Cave",
      "kind": "location",
      "anchor": {
        "x": 945,
        "y": 370
      },
      "parent": null
    },
    "sky_islands": {
      "id": "biome.sky_islands",
      "title": "Sky Islands",
      "kind": "biome",
      "anchor": {
        "x": 165,
        "y": 235
      },
      "parent": null
    },
    "stone_crossing": {
      "id": "location.stone_crossing",
      "title": "Stone Crossing",
      "kind": "location",
      "anchor": {
        "x": 710,
        "y": 655
      },
      "parent": "eastern_plains"
    },
    "sunward_fields": {
      "id": "biome.sunward_fields",
      "title": "The Sunward Fields",
      "kind": "biome",
      "anchor": {
        "x": 470,
        "y": 690
      },
      "parent": null
    },
    "whispering_marsh": {
      "id": "biome.whispering_marsh",
      "title": "Whispering Marsh",
      "kind": "biome",
      "anchor": {
        "x": 225,
        "y": 620
      },
      "parent": null
    }
  },
  "regions": {
    "eastern_plains": {
      "placeId": "biome.eastern_plains",
      "bounds": {
        "x": 619.8347107438017,
        "y": 320.06773920406437,
        "width": 320.06010518407214,
        "height": 339.5427603725656
      },
      "image": {
        "width": 426,
        "height": 401
      },
      "tiles": [
        {
          "src": "/assets/world/atlas/eastern_plains/0-0.webp",
          "x": 0,
          "y": 0,
          "width": 426,
          "height": 401
        }
      ],
      "description": "Wide open country east of the Great River, crossed by roads and pride routes and serving as the manticore homeland."
    },
    "enchanted_woods": {
      "placeId": "biome.enchanted_woods",
      "bounds": {
        "x": 39.81968444778362,
        "y": 265.02963590177814,
        "width": 340.34560480841475,
        "height": 309.9068585944115
      },
      "image": {
        "width": 453,
        "height": 366
      },
      "tiles": [
        {
          "src": "/assets/world/atlas/enchanted_woods/0-0.webp",
          "x": 0,
          "y": 0,
          "width": 453,
          "height": 366
        }
      ],
      "description": "An ancient living forest whose paths, clearings, and hidden places respond to memory, promises, damage, and the behavior of those who enter."
    },
    "expanse": {
      "placeId": "biome.expanse",
      "bounds": {
        "x": 259.9549211119459,
        "y": 0,
        "width": 450.03756574004507,
        "height": 270.1100762066046
      },
      "image": {
        "width": 599,
        "height": 319
      },
      "tiles": [
        {
          "src": "/assets/world/atlas/expanse/0-0.webp",
          "x": 0,
          "y": 0,
          "width": 512,
          "height": 319
        },
        {
          "src": "/assets/world/atlas/expanse/512-0.webp",
          "x": 512,
          "y": 0,
          "width": 87,
          "height": 319
        }
      ],
      "description": "A vast northern waste where nothing visibly grows and no confirmed population, ecology, or civilization has been established."
    },
    "frostfang_peaks": {
      "placeId": "biome.frostfang_peaks",
      "bounds": {
        "x": 649.8873027798647,
        "y": 120.23708721422523,
        "width": 329.82719759579265,
        "height": 289.5850973751059
      },
      "image": {
        "width": 439,
        "height": 342
      },
      "tiles": [
        {
          "src": "/assets/world/atlas/frostfang_peaks/0-0.webp",
          "x": 0,
          "y": 0,
          "width": 439,
          "height": 342
        }
      ],
      "description": "A vast frozen mountain range of cliffs, passes, and aeries that forms the griffin homeland and watches the northern horizon."
    },
    "glacier_of_origins": {
      "placeId": "biome.glacier_of_origins",
      "bounds": {
        "x": 649.8873027798647,
        "y": 0,
        "width": 299.77460555972954,
        "height": 209.99153259949196
      },
      "image": {
        "width": 399,
        "height": 248
      },
      "tiles": [
        {
          "src": "/assets/world/atlas/glacier_of_origins/0-0.webp",
          "x": 0,
          "y": 0,
          "width": 399,
          "height": 248
        }
      ],
      "description": "An ancient northeastern glacier where the Great River begins and fragments of old memory are said to remain preserved in the ice."
    },
    "mermaid_cove": {
      "placeId": "biome.mermaid_cove",
      "bounds": {
        "x": 549.962434259955,
        "y": 790.008467400508,
        "width": 290.00751314800897,
        "height": 209.99153259949196
      },
      "image": {
        "width": 386,
        "height": 248
      },
      "tiles": [
        {
          "src": "/assets/world/atlas/mermaid_cove/0-0.webp",
          "x": 0,
          "y": 0,
          "width": 386,
          "height": 248
        }
      ],
      "description": "A warm southern cove of coral reefs, sheltered water, merfolk and selkie communities, and an ancient alliance."
    },
    "plains": {
      "placeId": "biome.plains",
      "bounds": {
        "x": 320.06010518407214,
        "y": 399.6613039796782,
        "width": 329.82719759579265,
        "height": 259.9491955969517
      },
      "image": {
        "width": 439,
        "height": 307
      },
      "tiles": [
        {
          "src": "/assets/world/atlas/plains/0-0.webp",
          "x": 0,
          "y": 0,
          "width": 439,
          "height": 307
        }
      ],
      "description": "The central open country of the realm, crossed by old roads, caravans, and routes connecting the forest, foothills, fields, river, and coast."
    },
    "red_sky_foothills": {
      "placeId": "biome.red_sky_foothills",
      "bounds": {
        "x": 280.2404207362885,
        "y": 239.62743437764604,
        "width": 379.4139744552968,
        "height": 290.4318374259102
      },
      "image": {
        "width": 505,